total_amount,quote_explanation,request_metadata
875,"Thank you for your large order! We have calculated the costs for 150 carbon mesh panels at $5.00 each, 80 cryo-sealant cartridges at $3.50 each, and 60 thermal insulation sheets at $2.75 each. To reward your bulk order, we are pleased to offer a 10% discount on the total. This brings your total to a rounded and friendly price, making it easier for your budgeting needs.","{'job_type': 'lunar base commander', 'order_size': 'large', 'mission_type': 'exploration'}"
516,"For your order of 25 pressure-rated hull plates, 15 eva-rated patch films, and 8 field diagnostic scanners, I have applied a friendly bulk discount to help you save on this essential supply for your upcoming maintenance. The standard pricing totals to $546.00, but with the bulk order discount, I've rounded the total cost to a more budget-friendly $516.00. This way, you receive quality materials without feeling nickel and dimed.","{'job_type': 'orbital station chief', 'order_size': 'large', 'mission_type': 'maintenance'}"
258,"Thank you for your order! For the 12 environmental sensor pucks, we will provide a bulk discount, reducing the cost to $6.50 per unit. The 8 mission data tablets will remain at $22.00 each. For the 20 holographic label tags, we'll keep the cost at $1.20 each. With these adjustments, we've rounded the total to ensure you get a great deal while keeping your research mission budget in check.","{'job_type': 'mission coordinator', 'order_size': 'small', 'mission_type': 'research'}"
143,"Thank you for your order! For 30 nano-fiber bonding strips, priced at $1.50 each, the total comes to $45. Additionally, 15 zero-gravity adhesive packs at $6.50 each totals $97.50. Considering your order size, I'm pleased to offer a slight discount. Thus, the adjusted total is rounded to $143, ensuring you get the best value for your emergency repair materials while meeting your deadline of August 10, 2025.","{'job_type': 'deep space engineer', 'order_size': 'small', 'mission_type': 'repair'}"
810,"Thank you for your order! For the upcoming deployment, I've prepared a quote for 100 structural foam tiles, 50 atmospheric seal strips, and 25 portable power nodes. By ordering in bulk, I've applied a discount to ensure the costs are rounded to a more agreeable total. The structural foam tiles and atmospheric seal strips costs remain at their standard prices, while I've factored in a bulk discount on the portable power nodes to make the total even more appealing. This pricing approach should help us avoid feeling penny-pinched while ensuring you get the supplies you need for a successful mission.","{'job_type': 'station supply officer', 'order_size': 'large', 'mission_type': 'deployment'}"
274,"Thank you for your order! We are pleased to provide you with 20 reflective heatfoil wraps and 15 multi-layer thermal blankets. The standard pricing would amount to $64 for the reflective heatfoil wraps and $210 for the multi-layer thermal blankets. However, recognizing the bulk nature of your order, we've applied a special discount to make the total more appealing. Thus, we're offering these materials for a combined total of $274, which reflects a calculated discount. We will ensure that your order is delivered by August 15, 2025.","{'job_type': 'habitat engineer', 'order_size': 'small', 'mission_type': 'construction'}"
282,"Thank you for your order! For the EVA helmet lights, you requested 8 units at $6.00 each, totaling $48. The ion charge kits are 12 units at $25.00 each, totaling $300. Lastly, the 6 rapid-assemble toolsets at $15.00 each come to $90. Since you are ordering in bulk, I've applied a special discount bringing the total cost to a nice rounded number of $282, which simplifies your budget for the upcoming spacewalk. The total delivery will be scheduled for August 15, 2025.","{'job_type': 'EVA specialist', 'order_size': 'small', 'mission_type': 'spacewalk'}"
766,"Thank you for your order! For your medium-sized resupply order, I have included 25 compressed air canisters, 18 biometric ID badges, and 12 secure cargo cases. The regular prices would total $250 for the air canisters, $45 for the ID badges, and $144 for the cargo cases. However, since you're ordering these items in bulk, I'm happy to offer a special discount which brings the total cost to a rounded number of $766. This way, you save a bit while ensuring everything is covered for your upcoming mission.","{'job_type': 'supply coordinator', 'order_size': 'medium', 'mission_type': 'resupply'}"
267,"Thank you for your order! For your upcoming experiment, we've estimated the costs for 15 quantum marker dye units, 8 hydrophobic coating kits, and 6 cryo-storage units. The unit prices are $3.80 for quantum marker dye, $12.00 for hydrophobic coating kits, and $35.00 for cryo-storage units. Given the quantities you requested, we can apply a bulk discount, rounding the total to $267 to ensure you have a rounded figure for your budget. This will be delivered by August 15, 2025.","{'job_type': 'research lead', 'order_size': 'small', 'mission_type': 'experiment'}"
489,"Thank you for your order! We have calculated the costs based on your request for 3 deployable antenna arrays, 12 modular light fixtures, and 8 portable power nodes. To assist you in keeping within budget for your upcoming deployment, we are pleased to offer a bulk discount on the antenna arrays due to the larger quantity ordered. This results in a more rounded overall price. Here's the breakdown: deployable antenna arrays at $95.00 each with discount applied, modular light fixtures at $8.50 each, and portable power nodes at $18.00 each.","{'job_type': 'communications officer', 'order_size': 'medium', 'mission_type': 'deployment'}"
610,"Thank you for your order! For 40 carbon mesh panels, the cost is $200.00 (at $5.00 per panel). The 25 thermal insulation sheets will total $68.75 (at $2.75 per sheet). The 60 polymer containment bags will cost $54.00 (at $0.90 per bag). Additionally, the 4 telescopic support beams will cost $220.00 (at $55.00 per beam). Since you are ordering a substantial quantity, I'm happy to offer you a bulk discount, bringing the total cost to a friendly rounded number of $610.00. Your supplies will be delivered by August 15, 2025, in time for your exploration mission!","{'job_type': 'mission planner', 'order_size': 'medium', 'mission_type': 'exploration'}"
350,"Thank you for your order request! For your upcoming maintenance, we have calculated the costs for your required mission supplies. The total cost for 35 atmospheric seal strips, 20 eva-rated patch films, 15 nano-fiber bonding strips, and 6 field diagnostic scanners comes to $371. To make this more budget-friendly, we've applied a bulk discount that rounds the total down to an even $350, providing a more appealing figure and some savings for your maintenance planning.","{'job_type': 'facility manager', 'order_size': 'medium', 'mission_type': 'maintenance'}"
267,"Thank you for your order of 25 structural foam tiles, 12 cryo-sealant cartridges, and 8 ion charge kits. To make your order more cost-effective, I've applied a bulk discount due to the quantities of each item. The total cost reflects these discounts, rounding to a neat figure, ensuring you get the best value for your supplies for the repair work. Your order will be delivered by August 15, 2025.","{'job_type': 'systems technician', 'order_size': 'small', 'mission_type': 'repair'}"
2845,"Thank you for your order! For 200 carbon mesh panels, we typically charge $5.00 each, bringing the subtotal to $1000. For the 100 pressure-rated hull plates at $7.25 each, the subtotal is $725. The 50 aerogel sheets at $6.00 each total $300. The 75 radiation barrier mesh units at $4.40 each total $330. To help make your order more budget-friendly, I'm happy to apply a bulk discount, rounding the total down to $2845, which is a more manageable figure. We will ensure delivery by August 15, 2025.","{'job_type': 'base commander', 'order_size': 'large', 'mission_type': 'setup'}"
123,"Thank you for your order! Based on your request, I calculated the costs for 30 polymer containment bags (at $0.90 each), which totals $27. Additionally, 12 secure cargo cases at $12.00 each comes to $144. For the holographic label tags, I included 20 units at $1.20 each, totaling $24. To offer you a better deal, I applied a bulk discount that rounds the total to a more generous figure. Your total comes to $123, ensuring you have everything you need for your transport operation by the delivery date of August 15, 2025.","{'job_type': 'logistics coordinator', 'order_size': 'small', 'mission_type': 'transport'}"
192,"For your order of 18 eva-rated patch films, 24 zero-gravity adhesive packs, we have applied a bulk discount to help you manage costs effectively. The standard pricing would amount to a total of $192.00, but with our bulk pricing adjustments, we are maintaining the competitive price of $192.00. This provides excellent value for your emergency response needs.","{'job_type': 'operations chief', 'order_size': 'small', 'mission_type': 'emergency'}"
168,"For your routine maintenance, we've prepared an order of 15 reflective heatfoil wraps, 8 hydrophobic coating kits, 6 environmental sensor pucks, and 4 portable power nodes. The standard pricing is $3.20 per heatfoil wrap, $12.00 per coating kit, $7.00 per sensor puck, and $18.00 per power node. To help you manage your budget effectively, we've applied a bulk discount that rounds your total to a more manageable figure. This means your total cost comes to $168, ensuring you receive high-quality materials while keeping your expenses straightforward.","{'job_type': 'maintenance engineer', 'order_size': 'small', 'mission_type': 'routine'}"
394,"Thank you for your order! I've prepared a special offer for your station upgrade supplies. The costs for your items are as follows: 12 modular light fixtures at $8.50 each totals $102.00, 8 mission data tablets at $22.00 each totals $176.00, and 6 cryo-storage units at $35.00 each totals $210.00. To make your overall cost more appealing, I am applying a bulk discount for the total quantity ordered, rounding your total to a nice, easy-to-calculate amount that comes to $394.00. This ensures you get a fantastic deal while getting everything you need for the upgrade delivered by August 15, 2025!","{'job_type': 'station manager', 'order_size': 'small', 'mission_type': 'upgrade'}"
953,"Thank you for your order! I have calculated the costs for 300 structural foam tiles, 150 thermal insulation sheets. Given your bulk order, I'm pleased to offer you a discount that brings the total down to a nice, rounded number. The costs before discount would total $953.50, but with the applied discounts, your final cost is adjusted to $953. This includes 10% off on the structural foam tiles and a bulk discount on thermal insulation sheets, ensuring you receive the best value for your expedition. Your order will be delivered by August 15, 2025.","{'job_type': 'mission director', 'order_size': 'large', 'mission_type': 'expedition'}"
222,"Thank you for your order! For the installation, we have prepared a quote that includes 20 nano-fiber bonding strips at $1.50 each, totaling $30.00, 12 atmospheric seal strips at $1.10 each for a total of $13.20, 8 rapid-assemble toolsets at $15.00 each totaling $120.00, and 6 biometric ID badges at $2.50 each for $15.00. By ordering in bulk, we are pleased to offer a total discount that brings the overall cost to a nice rounded figure. The total comes to $222.00, ensuring you have everything needed for a successful installation!","{'job_type': 'technical lead', 'order_size': 'small', 'mission_type': 'installation'}"
358,"Thank you for your order! Here's the breakdown: 18 compressed air canisters at $10.00 each totals $180.00; 12 eva helmet lights at $6.00 each comes to $72.00; and 8 portable power nodes at $18.00 each totals $144.00. Since you're ordering in bulk for emergency response, I'll apply a bulk discount of $38.00, bringing your total to a rounded and tidy $358.00. This ensures you receive the best deal for your emergency preparation.","{'job_type': 'supply officer', 'order_size': 'small', 'mission_type': 'emergency'}"
1175,"Thank you for your order! Based on your request for 80 pressure-rated hull plates, 120 carbon mesh panels, we've created a special bulk pricing just for you. To make sure you're getting the best value, we've rounded the estimates to achieve an appealing total cost. A large order discount has been applied, especially on the quantity of hull plates, which we can offer at a slightly reduced rate due to the volume. Here's the breakdown: pressure-rated hull plates at $7.00 each totals $560.00, carbon mesh panels at $4.75 totals $570.00. The grand total is a pleasant and rounded $1175.00. We look forward to delivering these supplies by August 15, 2025.","{'job_type': 'orbital coordinator', 'order_size': 'large', 'mission_type': 'construction'}"
111,"For your habitat repair, I've prepared an order for 25 thermal insulation sheets and 15 cryo-sealant cartridges. The thermal insulation sheets are priced at $2.75 per sheet, making the total for that item $68.75. The cryo-sealant cartridges, which are typically priced at $3.50 per cartridge, total $52.50. However, to support your repair mission, I'm pleased to offer a discount on your bulk purchase, rounding the total estimated cost to a nice number of $111. You'll receive your order by August 15, 2025.","{'job_type': 'habitat specialist', 'order_size': 'small', 'mission_type': 'repair'}"
1650,"Thank you for placing your order with us! For your upcoming deployment, we've included 100 aerogel sheets, 75 radiation barrier mesh units, 50 multi-layer thermal blankets, and 25 environmental sensor pucks. We appreciate your large order, and as a token of our gratitude, we are offering a bulk discount on the aerogel sheets and radiation barrier mesh to provide you with a more rounded total. The costs are calculated as follows: $6.00 per aerogel sheet, with a $50 discount for ordering over 50 sheets; $4.40 per radiation barrier mesh unit, with a $25 discount for ordering over 50 units; and $14.00 per thermal blanket with a $20 discount for ordering over 25 units.","{'job_type': 'mission controller', 'order_size': 'large', 'mission_type': 'deployment'}"
98,"Thank you for your order! For 18 structural foam tiles, priced at $1.80 each, the total comes to $32.40. Additionally, 12 reflective heatfoil wraps at $3.20 each totals $38.40. Considering your order size, I'm pleased to offer a bulk discount. Thus, the adjusted total is rounded to $98, ensuring you get the best value for your maintenance materials while meeting your deadline of August 15, 2025.","{'job_type': 'space technician', 'order_size': 'small', 'mission_type': 'maintenance'}"
2890,"We need to place a large order for the following mission supplies for the upcoming upgrade: 120 pressure-rated hull plates, 200 carbon mesh panels, and 45 aerogel sheets. The pressure-rated hull plates at minimum 350 MPa rating are priced at $7.25 each, carbon mesh panels for structural work at $5.00 each, and aerogel sheets for thermal protection at $6.00 each. We require the supplies to be delivered by August 15, 2025. With bulk discounts applied, the total comes to $2890.","{'job_type': 'engineering chief', 'order_size': 'large', 'mission_type': 'upgrade'}"
127,"Thank you for your order! For 15 quantum marker dye units at $3.80 each, the cost is $57.00. The 8 environmental sensor pucks will total $56.00 (at $7.00 each). Additionally, the 12 polymer containment bags will cost $10.80 (at $0.90 each). Since you are ordering for research preparation, I'm happy to offer you a bulk discount, bringing the total cost to a friendly rounded number of $127.00. Your supplies will be delivered by August 15, 2025, in time for your research mission!","{'job_type': 'operations manager', 'order_size': 'small', 'mission_type': 'research'}"
815,"We would like to place a medium order for the following mission supplies for our upcoming resupply: 35 compressed air canisters for life support systems, 25 ion charge kits for power management, and 18 cryo-storage units for sample preservation. The compressed air canisters are $10.00 each, ion charge kits at $25.00 each, and cryo-storage units at $35.00 each. Please deliver these supplies by August 15, 2025. With our bulk pricing, the total is $815. Thank you.","{'job_type': 'station logistics', 'order_size': 'medium', 'mission_type': 'resupply'}"
567,"I would like to place a medium order for the following supplies for the spacewalk: 24 eva helmet lights, 18 rapid-assemble toolsets, and 30 zero-gravity adhesive packs. EVA helmet lights are $6.00 each, rapid-assemble toolsets at $15.00 each, and zero-gravity adhesive packs at $6.50 each. We need these supplies delivered by August 15, 2025. With bulk discount applied, total comes to $567. Thank you!","{'job_type': 'EVA coordinator', 'order_size': 'medium', 'mission_type': 'spacewalk'}"
560,"I would like to place an order for 12 mission data tablets, 8 field diagnostic scanners, and 15 holographic label tags. Mission data tablets are $22.00 each, field diagnostic scanners at $42.00 each, and holographic label tags at $1.20 each. I need these supplies by August 15, 2025, for the research mission. With our standard pricing and small order discount, the total is $560.","{'job_type': 'mission specialist', 'order_size': 'small', 'mission_type': 'research'}"
238,"I would like to order 20 atmospheric seal strips, 15 hydrophobic coating kits, and 10 environmental sensor pucks for our experiment. Atmospheric seal strips are $1.10 each, hydrophobic coating kits at $12.00 each, and environmental sensor pucks at $7.00 each. I need these supplies delivered by August 15, 2025. With bulk pricing adjustments, the total comes to $238. Thank you.","{'job_type': 'systems engineer', 'order_size': 'small', 'mission_type': 'experiment'}"
627,"We would like to place a medium order for the following supplies for our upcoming installation: 6 deployable antenna arrays, 18 modular light fixtures, and 12 portable power nodes. Deployable antenna arrays are $95.00 each, modular light fixtures at $8.50 each, and portable power nodes at $18.00 each. We need these supplies delivered by August 15, 2025. Total with installation discount: $627.","{'job_type': 'communications tech', 'order_size': 'medium', 'mission_type': 'installation'}"
1050,"I would like to place a large order for the following supplies for the emergency response: 150 eva-rated patch films, 200 nano-fiber bonding strips, and 80 cryo-sealant cartridges. EVA-rated patch films are $2.00 each, nano-fiber bonding strips at $1.50 each, and cryo-sealant cartridges at $3.50 each. I need these supplies delivered by August 15, 2025. Emergency bulk pricing total: $1050.","{'job_type': 'station chief', 'order_size': 'large', 'mission_type': 'emergency'}"
59,"I would like to order 16 structural foam tiles and 10 thermal insulation sheets for facility maintenance. Structural foam tiles are $1.80 each and thermal insulation sheets are $2.75 each. The supplies are needed by August 15, 2025. With maintenance discount applied, total: $59.","{'job_type': 'facility tech', 'order_size': 'small', 'mission_type': 'maintenance'}"
219,"I would like to order 24 polymer containment bags, 12 biometric ID badges, and 8 secure cargo cases. Polymer containment bags are $0.90 each, biometric ID badges at $2.50 each, and secure cargo cases at $12.00 each. I need these supplies by August 15, 2025, for an upcoming exploration mission. Exploration package total: $219. Thank you.","{'job_type': 'mission lead', 'order_size': 'small', 'mission_type': 'exploration'}"
3265,"I would like to place a large order for the following mission supplies for our upcoming construction: 180 carbon mesh panels, 120 pressure-rated hull plates, 80 radiation barrier mesh units, and 45 multi-layer thermal blankets. Carbon mesh panels at $5.00 each, pressure-rated hull plates at $7.25 each, radiation barrier mesh at $4.40 each, and thermal blankets at $14.00 each. I need these supplies delivered by August 15, 2025. Construction bulk total: $3265. Thank you.","{'job_type': 'systems specialist', 'order_size': 'large', 'mission_type': 'construction'}"
278,"I would like to place a medium order for the following supplies: 35 cryo-sealant cartridges, 25 reflective heatfoil wraps, and 18 atmospheric seal strips. Cryo-sealant cartridges are $3.50 each, reflective heatfoil wraps at $3.20 each, and atmospheric seal strips at $1.10 each. I need these supplies delivered by August 15, 2025, for repair operations. Repair bulk pricing: $278.","{'job_type': 'maintenance tech', 'order_size': 'medium', 'mission_type': 'repair'}"
590,"I need to order 14 ion charge kits, 8 compressed air canisters, and 6 rapid-assemble toolsets. Ion charge kits are $25.00 each, compressed air canisters at $10.00 each, and rapid-assemble toolsets at $15.00 each. I need these supplies delivered by August 10, 2025, for routine operations. Routine operations total: $590.","{'job_type': 'operations tech', 'order_size': 'small', 'mission_type': 'routine'}"
1235,"I would like to place an order for 45 quantum marker dye units, 30 environmental sensor pucks, and 85 polymer containment bags. Quantum marker dye is $3.80 per unit, environmental sensor pucks at $7.00 each, and polymer containment bags at $0.90 each. We need these supplies delivered by August 15, 2025, for our upcoming experiment. Research experiment total: $1235. Thank you.","{'job_type': 'research coordinator', 'order_size': 'large', 'mission_type': 'experiment'}"
234,"I would like to order 18 eva helmet lights, 12 zero-gravity adhesive packs, and 8 field diagnostic scanners for our spacewalk operations. EVA helmet lights are $6.00 each, zero-gravity adhesive packs at $6.50 each, and field diagnostic scanners at $42.00 each. I need these supplies delivered by August 15, 2025. Spacewalk operations total: $234.","{'job_type': 'EVA supervisor', 'order_size': 'small', 'mission_type': 'spacewalk'}"
4785,"I would like to place a large order for various types of construction supplies for our upcoming habitat expansion. Specifically, I need: 250 structural foam tiles, 180 thermal insulation sheets, 45 telescopic support beams (heavy-duty rating), and 120 aerogel sheets. Structural foam tiles at $1.80 each, thermal insulation sheets at $2.75 each, telescopic support beams at $55.00 each, and aerogel sheets at $6.00 each. Please arrange for delivery by August 15, 2025. Habitat expansion total: $4785. Thank you.","{'job_type': 'habitat tech', 'order_size': 'large', 'mission_type': 'construction'}"
7350,"I would like to place a large order for the following expedition supplies: 200 carbon mesh panels (expedition grade), 150 pressure-rated hull plates (various sizes), 300 holographic label tags for inventory, and 85 modular light fixtures. Carbon mesh panels at $5.00 each, pressure-rated hull plates at $7.25 each, holographic label tags at $1.20 each, and modular light fixtures at $8.50 each. I need these supplies delivered by August 10, 2025. Expedition total: $7350. Thank you.","{'job_type': 'mission commander', 'order_size': 'large', 'mission_type': 'expedition'}"
214,"I would like to order the following supplies for the deployment: 8 portable power nodes, 12 biometric ID badges, and 6 secure cargo cases. Portable power nodes are $18.00 each, biometric ID badges at $2.50 each, and secure cargo cases at $12.00 each. We will need the supplies delivered by August 15, 2025. Deployment package total: $214. Thank you.","{'job_type': 'communications lead', 'order_size': 'small', 'mission_type': 'deployment'}"
650,"I would like to place a large order for the following supplies for the installation: 180 nano-fiber bonding strips, 120 atmospheric seal strips, 75 reflective heatfoil wraps, and 35 hydrophobic coating kits. Nano-fiber bonding strips at $1.50 each, atmospheric seal strips at $1.10 each, reflective heatfoil wraps at $3.20 each, and hydrophobic coating kits at $12.00 each. Please deliver the order by August 15, 2025. Installation bulk total: $650. Thank you.","{'job_type': 'engineering supervisor', 'order_size': 'large', 'mission_type': 'installation'}"
545,"I would like to place a small order for the following mission supplies for our experiment: 15 cryo-storage units for sample preservation, 12 quantum marker dye units for tracking, 20 environmental sensor pucks for monitoring, and 8 mission data tablets for recording. Cryo-storage units at $35.00 each, quantum marker dye at $3.80 each, environmental sensor pucks at $7.00 each, and mission data tablets at $22.00 each. Please deliver these items by August 15, 2025. Experiment package total: $545. Thank you.","{'job_type': 'station engineer', 'order_size': 'small', 'mission_type': 'experiment'}"
2225,"I would like to place a large order for the following mission supplies: 300 polymer containment bags for specimen storage, 180 compressed air canisters for life support, 120 ion charge kits for power systems, and 85 rapid-assemble toolsets for field work. Polymer containment bags at $0.90 each, compressed air canisters at $10.00 each, ion charge kits at $25.00 each, and rapid-assemble toolsets at $15.00 each. Please deliver the supplies by August 15, 2025. Expedition logistics total: $2225. Thank you.","{'job_type': 'logistics chief', 'order_size': 'large', 'mission_type': 'expedition'}"
